566|f4bb446574feb8633acb5664566c220b|Mein Onkel war mal Gerüstbauer.
567|22d01150d2549b0a5f32b5eaff8c449c|So zum Beispiel am Flughafen von Kuala Lumpur.
568|fa9ee3e9d92512fba9243f24f1497bf7|An welche Nation denn?
569|7abac985dc6b01f1373d4e9d940e6905|Aus Erfahrung wusste sie natürlich, dass es passt.
570|be741c3914f3389eaf91aefa76554387|Es kann auch darum gehen, dass Betreiber und Erzeuger ihre Ansprüche gegeneinander optimieren und zu jedem Zeitpunkt auch ein Überblick über die jeweilige Lage da ist.
571|d62b97598e95114419367ae1dc1ce145|Mit achtzehn ist man volljährig aber noch lange nicht vernünftig oder gar erwachsen.
572|b579eb06d7d8953b2688e6fe13c5af46|Ich bedanke mich recht herzlich für Ihre Aufmerksamkeit.
573|8c16ef39db065a21be40a8c73a64d9af|Du bist nicht fair, deine Fairness lässt zu wünschen übrig.
574|96cc2b8000e1e99d03622f5b4921fd89|Wir treffen uns an der Straßenbahnhaltestelle vor der Synagoge.
575|8012659c9aaef96a6a7f9ee815f9abda|Das hat Polanski nie so gesagt.
576|53a3291213e2f00e6712f5d63f305f0e|Nämlich das Aussitzen des Skandals.
577|22e0c134ce3dab19dfccea209eac4808|Im Erdgeschoss zu wohnen, hat nicht nur Vorteile.
578|ca1f1786113d7218fa233bab3eb050bc|Ich glaube, das ist ganz wichtig, weil die Bürgerinnen und Bürger den Eindruck haben: Wir haben schon viel abgemacht, aber vieles von dem ist auch nicht durchgesetzt worden.
579|efd76347dffbb21bd710c14bce094422|Wie erklärt man das kindgerecht?
580|7f69125aa157a362934b063427fb52ed|Ein Blick über den eigenen Tellerrand hinaus würde sich lohnen.
581|ddf98db81c93687f179143674c342b39|rechts
582|e4c176a48ef6c1657e44697375b1d4ae|Dann hältst du bei einer roten Ampel also auch nicht an?
583|cda20756c9b0685c284d427ab2674f67|Wer will noch mehr Sätze Korrektur lesen?
584|2fe5a767039b22ad054cd127840288e8|Jetzt generiere du doch auch mal ein paar neue Sätze.
585|2f00abeb9017db109b679afa106fca0b|Endlich liest mal wieder eine Frau vor!
586|375ee26098b46e23bcb854331f0ad8c5|Ja
587|92c794922c62efd07fe5f425c892b451|Im Städtischen Anzeiger findet man auch nichts dazu.
588|d43f1019a8d7c5d3d1a577d36400bdf5|feuere
589|3f7f226835efbabb72f1fae71656d658|Ich bin zuversichtlich, dass er das wuppen wird.
590|352645c81e3d5af11880bbf62493fdda|Belastbare Studien dazu liegen noch nicht vor.
591|1a304b8914154b46bb4c3e77b9ed9ad9|Es ist fünf vor Zwölf.
592|6ce2925c6be92e204ee713f6ba47a5fe|Farbtemperatur
593|0504582c0afb93772f40ce4af37520eb|Realistische Grafik ist nicht alles.
594|e17de713ce696c7f209ced44bc1b9990|Ein klarer Fall von höherer Gewalt.
595|bde65ad596939aac2ffa75bf06fab13a|Außerdem hat China auch selber gemerkt, dass es für die eigenen Bevölkerung viel günstiger ist, wenn man sorgsam mit der Umwelt umgeht.
596|9aebecc0463262d9ba31c1267249dc8f|Warum nicht
597|13a7a3a33b96cf75e9a97809cecce47a|Der Edeka wurde ungewollt zum Schauplatz eines Flashmobs.
598|90d5bf12f50038e577134fe7310721ed|warum machst
599|150eaed5d7c4b54ad9cd251264055cd6|Zumal sich am Ende sowieso irgendwer verletzt fühlen würde.
600|fb371de6a3cd064038a80641f59944f1|Vielen Dank für den Hinweis.
601|12dd29ea724d2ce1f828f605fcc10b2e|Statt des Originals wurde ein furchtbares Cover aufgelegt.
602|b09d951db7e2af04f6a5a08b3c9bc467|In dem Sachgebiet G ist die Vollstreckung mit den Vollziehern von Bundesforderungen zusammengefasst.
603|e1fb303cade94b5d66fd3e0286c16a4a|Sie macht sich Vorwürfe.
604|7759e03d2cc0d0c4d3f79196aa3c53cc|Komm, wir ziehen dich gleich an.
605|de1ee998f80fcd32a822588ce89e6576|Wir machen das Pi mal Daumen.
606|864ac9ea086018882685583f6272f188|So zumindest habe ich es verstanden.
607|c049e5fb1d88d6f398d09b03b424bb45|All denen, die in diesem Jahr mit Sorgen und mit Trauer leben mussten, wünsche ich Trost und Kraft, um den Beginn des neuen Jahres mit neuer Zuversicht begehen zu können.
608|e50151e7728025893aef7a80252e91c2|Die australische Schönheit begann gerade durchzustarten.
609|da62e2c0a4c89add938174f4c6dd8641|Einmal ist keinmal, sagt meine Mutter.
610|ab4bcdfcd7815d7552223781578de560|Jeder fasst sich täglich dutzende Male mit der Hand ins Gesicht.
611|a6d5022186730947df1de506308b1109|Höchste Konzentration ist gefordert.
612|ebabe1bb374f2c43646cc9dfa1dfb8a9|Was die Vase anbelangt, machen Sie sich keine Sorgen.
613|0812229e6dff0464c5efd5e47eef44ee|V, wie Viktor
614|73d0f8f376e3d07552fd29d2d7ea9bd5|Angesichts der jüngsten Entwicklungen auf dem Immobilienmarkt wird er kleinere Brötchen backen müssen.
615|9e8157c7560068d5ae1b5459dae17141|Eine alternative Auktionsplattform mit vernünftigem Datenschutz wäre wünschenswert.
616|a4e4c085e977360591e0077962c17896|Das müssen Sie genauer ausführen.
617|4c9596acd45af0cfc5800a6c32f03c09|Heute muss man anerkennen, dass Karola ihrer Zeit einfach voraus war.
618|3111f2ebfdea0fa43487884641a16b46|Ansonsten ist es überflüssig wie ein Kropf.
619|cfb9137abaa878ab654e1cae1cd500d6|Wegen Bauarbeiten im Hörsaal muss die Physikvorlesung in den Hilbertraum verlegt werden.
620|8000aababc883cc7ae43cd8424e7703d|Langsam zuckeln die Touristen von Sehenswürdigkeit zu Sehenswürdigkeit.
621|6e054ac7a80336cb1d3f0b386db68f50|Denn es geht gerade um junge Künstlerinnen und Künstler, die noch kein finanzielles Polster haben, um sich mit Raubkopien auseinandersetzen zu können.
622|83718b755e43e51f706db58349ea55bd|Professoren und Studenten kennen sich sogar persönlich.
623|3ac37fdedcf9fa2a8f5ea782d12f0253|Damit sind sie aber nicht alleine.
624|b40a05424e9143d404f63eb53f950ba9|Karl Klammer soll bitte sofort verschwinden!
625|05d4601b8813a2942444f9db79edf54f|Der Straßenbauer war mit aufwendigen Pflasterarbeiten beschäftigt.
626|e5a354cbba5ca4da24b91aafaf4a81e9|An diesen fünf untrüglichen Anzeichen erkennen Sie einen Lügner.
627|78c7a6beb73ad34fb085697bc7f6e4d2|Alles, was ihr mitnehmt, müsst ihr auch selber tragen.
628|0adf0b8c1d828ea8a7cc90a486f3c3e0|Eine Aura von über vier Metern Ausdehnung ist beachtlich.
629|fb48de6f7b1cd0b31e3f695a512b5d14|Wir werden nichts unversucht lassen.
630|c3f9912408ad366ca26f338d3c5c819e|Der Schiedsrichter wird nach traditioneller Art ausgepfiffen.
631|0693840a8592a3253ef37cbc16e43877|Woher soll er denn heute noch wissen, was er gestern getan hat?
632|4a7f4f2e8bd48d9fd2e86fcdfa520f0b|Tatsächlich wird Sand ein immer knapperes Gut.
633|4532c160b4011993994b6d7b15bd50df|Den ausgetrockneten Sumpf konnte man problemlos zu Fuß durchqueren.
634|4166872ea9a5a2518f5b421fbfbb900b|Die neue Azubine schlägt sich ganz wacker.
635|7e9e07873b40be65078b82645db2bd56|Man kann nicht überprüfen, ob jemand etwas wirklich gelöscht hat.
636|580fa20cf4fcacd72e22e1e7bb65c627|Sauerteig ist meistens im Einzelhandel erhältlich.
637|b71588ff7785a87a27979ea0f2bdb23f|Jannick jagt jetzt Jessica Jüllich.
638|f5957e369a9d039cc0bb6c96de3e6e65|Erwartet mich bei dem Fest wieder so eine konservative Spießer-Gesellschaft?
639|964d0377f8ffecf7786257d80322cc02|So, wie es aussieht, will Frau Birkenhagen sie nicht einmal geschenkt.
640|32eb2e072f984c14a86e0141ab7c5951|Der Mensch denkt assoziativ, auch wenn er kreativ sein soll.
641|f1aa9e4cfa5bf7cd4c244e194dd17010|Das muss ich mir nicht auch noch ans Bein binden.
642|5c1fff2f0d5c9bc6dbe53e54d149a4e9|Das hast du bestimmt nur geträumt!
643|0cd9ef70e4ed26bc8a6b3268f4336948|Hinter dieser Wand befindet sich ein Hohlraum.
644|61782d47522f20480d719769dc92a9cb|Und deshalb haben auch gerade Bürgerinnen und Bürger aus den neuen Bundesländern ein ganz besonderes Interesse nachzuschauen: Wie war es denn wirklich?
645|450bfa9d0f631b85715f18127f18eccf|Hat die Schulung etwas gebracht?
646|1e26d55dc9402095a5d0856f8ff2d95c|Sollte man Moore trockenlegen?
647|56594fff60a8b63130e3f0b701db3d19|Julina kann sich nicht vorstellen, dass Löschpapier brennt.
648|1001ba6c862f13b75ba8d2d8f67124be|Ich werde Ihre Sorge aufnehmen und mich auch nochmal bei den Gesprächen in Kienbaum erkundigen, dass da auch nicht Dinge, die vielleicht entstehen könnten, nicht entstehen können.
649|0c18ae660d002202d45c1a7555bad772|Um zwölf Uhr ist die Fütterung der Delfine.
650|99692ca12b98af68254b924de3d079db|Bestätige: Möchtest du den Alarm wirklich abbrechen?
651|7d2e836516baf4230a2fb83957435b08|Konnte Grubengas nachgewiesen werden?
652|cf6d8d4a1168f06b77d4b962c08d8e25|Das kann auch passieren, ne?
653|cbdbdb72014d1074733ebb6e458c3eb8|Ergebnis
654|ddf47ccd766666a04c684fafda548f1f|Südosten
655|db85be3d2af000108f966b4ac5c2efed|donnerstags
656|3ac7558c6af9fb96eb9637de7247fbdf|Nicht immer ist die Trennung der Zuständigkeiten eindeutig.
657|27a77ab7b0d452bcc724dd6173f46c8d|Es lohnt sich nicht, sich darüber den Kopf zu zerbrechen.
658|0fe1bfaae5a05682dfd0b4f32124d383|Wahre Schnäppchen muss man mit der Lupe suchen.
659|6dc1eb0ff9901892e4875c536af5ec12|Sie hatten recht, die Auswahl ist in der Tat etwas reichhaltiger.
660|27a7145480cd626d689668210e5718c4|vergiß
661|6609babb553de7ad14f2d0d5c27c3245|Während der Probe zerbrach er mehrere Stäbe.
662|a3a1191448ec4ee09f943104aefbb1a9|Teures Essen gibt es überall, aber nicht zum besten Preis-Leistungsverhältnis!
663|b9b373b5c163ad50f214cf007fb6cee6|Kein Kommentar!
664|5d62120ed7244fb58aab7a38d09e193f|Ach, den Abfall verklappen wir einfach irgendwo im Niemandsland.
665|615f90c822d558643f62c41e58617629|Beim Memory hat Nathanael wie immer abgeräumt.
666|b0de549ab74630f3ed29e3e3f0b64da4|Warum schickt mir die Krankenkasse ungefragt Werbung?
667|93f933a5dc932bccba9d8ed6f634b10a|Weißt du wo mein Schlüssel ist?
668|1129543c672312829ad3c71cc1fd532a|Der Ritter zog sein Schwert aus der Scheide.
669|f893c5a227de5be3dd7d65abe368a845|Außerdem natürlich eine Metal-Version und einen Techno-Remix.
670|d12a14b231152422471badd17ebc9362|Mehr Wirtschaftswachstum geht meist auch mit mehr Ressourcenverbrauch einher.
671|51c5be2769a9808f0d549861ec65baf6|Code Switching ist genauso alltäglich wie faszinierend.
672|78b610f38021581bd839a81ad59689f0|Jeder kann die Sperren nach fünf Minuten Googlen umgehen.
673|d5a369dc9055df6d017c1a549758cf4f|Das Kratzen ist total unangenehm.
674|a26940b26f8419d8a09f071bfcb1f8f1|Einmal Anrufen reicht für gewöhnlich.
675|9df33c9687f722d4ede5cd0bc2a6a9fb|Kinder bekommen grundsätzlich alle eine Schwimmweste.
676|467f3a511219dea32f3f6f6770a6c258|Lass uns lieber gleich einen dedizierten Server aufsetzen.
677|81441c881d03b6f118c3b77a19fc4653|Trotz der unerfreulichen Ereignisse, möchte ich noch mal an das Positive erinnern.
678|734817c414cb5d33eb599131c9a2b85f|Kürzlich kaufte Karin Kircher krasse Klamotten.
679|d8dafbf013422a2c670df0da15b1642e|Der Akku ist sowieso schon hinüber.
680|54be4973b436d4a6850118ee4bd38043|Es gab kein Fernsehen, keinen Computer, ja, nicht mal ein Telefon!
681|3028a085b86b09670caa120bc9b4d87f|Nein, jetzt musst du warten.
682|0a10f13f44b96f3472767c33130c8a9d|Betrete Fehlersuche für Pandora
683|2317db2b066e200e158d9349866ffc00|Wie sieht die Deklaration aus?
684|bbe47ae92b9e65aa5b70ad3f816e68ec|Polewskoi entstand siebzehnhundertacht nach der Entdeckung einer Kupfererzlagerstätte, deren systematischer Abbau siebzehnhundertachtzehn begann.
685|e2b261b4c38d99170d8ef84406e843e9|Nach maximal drei Schritten muss der Ball abgegeben werden.
686|a5a2f59fd7c5a99d3db08fa972f28788|Achten Sie auf die Formation.
687|12cdc631f59a6d58e222430f640e8053|Herr, erbarme dich!
688|1d5cfc4db951ec2f8954b46d3aba478b|Wer den Pfennig nicht ehrt, ist des Talers nicht wert.
689|bb5a3ad9997431fce71b37c8756513e3|Macht ihr etwa schon schlapp?
690|b1c6218e6c1c4f872c8d792daebe4652|Die einzige rechtmäßige Besitzerin der Stute ist Sinja Strunk.
691|1e5851e1c86fcb411196f6ab1b01e489|Hat ein Stoppschild sechs oder acht Ecken?
692|2ef8c6ee913902795723aecfda8bf220|Man muss es nicht mögen, aber man sollte tolerieren, wenn andere es machen.
693|4a009c37026e60cba46d0d69da20b3e9|Du bist so ein Charmeur!
694|efccefd0a898d5908cd66bf80dc821d7|Etwa zwei Kilometer braucht sie, um warm zu werden.
695|c2ab6b3bc1eac6938c019cd55fb3dc54|Die Personaler wollen sehen, wie Sie unter Stress reagieren.
696|cb700c677c4622d6e39255d5637a730c|Dort spielt die Musik!
697|8fc62c842cd69c8c8ec70b0b1d1003ab|Wissen Sie überhaupt, was exponentiell heißt?
698|4b130467b0c1ea273f209511cdc04c68|Denen wenden wir uns jetzt zu, das heißt, wir setzen auf den anfänglichen Abbau von Bürokratie im Bereich der Informationspflichten jetzt ein umfassenderes Konzept.
699|afb66e2b11527939dff4dab5772d4298|Wer den ganzen Tag am Malochen ist, sollte sich wenigstens seine Miete leisten können.
700|cb6577da63f1b80a4dc2272647d48e9c|Wo ist sie denn?
701|a36b19c02f07c1625ecc6d04b01a1707|Zur Authentisierung stellen Sie sich bitte vor die Kinect und tanzen Sie Ihr Passwort.
702|649c52ce45528d94601b22aeec674d5b|Bäume, Pilze und Bazillen sind Waldbewohner, die in einer Symbiose leben.
703|67b2e5b18d2e903e6abf29bbfd811521|Vielleicht kannst du dir ein Stück bei ihm abzwacken.
704|34e997da77895df5abb73d6677a84041|Dazu muss man sich doch etwas Bedenkzeit nehmen!
705|fed956388279f61050c36126fdc99d98|Bad Schwartau ist stolz auf Bodo Wartke.
706|644ea6ad063b3cce3f8b2440a59dcf4e|Dort parkt bereits ein Geländewagen mit Camouflage.
707|11192a68c04e20a3469ab0d60270200a|Leider habe ich mein Mikrofon in Eichstätt liegen lassen.
708|38e7d5f6bd86a99871508fb9e9e5fd23|Uns wird nichts anderes übrig bleiben.
709|94968cf23be1dd5e1651ea2bd1dd2a51|Oder spricht etwas dagegen?
710|c02570e8fc8ad323d0bd7305f4258f7a|Man hat ohnehin die beste Ausrede, weshalb man nicht auf der Tanzfläche steht.
711|b4cd6686558c8b9272cd8c8a0ddbd7f7|Markieren Sie alle Fotos, auf denen Fußgängerüberwege zu sehen sind!
712|e0eaee8f197e4d8cd90ce94a6ec6a2cd|Der neue Flughafen hat sich als Fass ohne Boden erwiesen.
713|58b515fd114dbd753feb338e4956470c|Bis auf wenige Ausnahmen schreibt man Zahlen klein.
714|1fc1b7e0d4de5a548d528b0c470df529|Scrolle normal nach unten
715|277d3a0fbf83118e38dc7969777f01de|Wenn du es nicht erklären kannst, hast du es auch nicht richtig verstanden.
716|3f82a8c048a25a0232929cea78aafc5e|Dann lass es liegen.
717|7f74e0cf91f3bac93ac14d3925d9e777|Geht ihr zur Kommunion?
718|76c8947b71a01ca9d15ea99b59871ff8|setze benutzerdefinierte Augen
719|f363146393599a7f24d774c6b296afe4|Stagnierende Umsätze sind das Resultat.
720|ded59fd66f9453aedbeb590b27fb24a8|Gibt es bald einen Marktplatz für Zeitungsschnipsel?
721|4da4926500b707f73699eca5f0029313|Wirklich machen
722|f4409ef06b64f1c9bda5a99790a629b6|Momentan laufen sieben Timer. Welchen möchtest du abbrechen?
723|e9c9ede6a80ef2cfad504ed892b2a380|Vorbeigehende Spaziergänger hielten das große Teleskop für ein Kanonenrohr.
724|52b603c9a3642c5d3e2313deace0b89a|Wie kommt eine Stadt darauf, sich Darmstadt zu nennen?
725|c8e3e89973bd46c9973a4d69c8c0ad17|Dabei wird die Vakuumröhre zerbersten.
726|af2368a31e9f690e4bb4d5acf996dbc2|Ist das Weltall unendlich?
727|9cadac0ba189ce77a5161ee09b168bb1|Ach du grüne Neune!
728|297883b9e7d4851612e3b5aed7986402|In der Schule denkt man noch, wer ein abgeschlossenes Studium hat, muss intelligent sein.
729|200126150c74e9d92e4192a7ac9e43cd|Für Radler ist Heiligendamm eine Zumutung.
730|678d40f4de3798e03ceff0e5e0c39235|Bist du etwa gerade erst aufgestanden?
731|db58b72877a2280ff022f29f23d9b198|Zweitens wird es um Wirtschaft und Wachstum ge­ hen, das ist ganz natürlich, denn wir haben ja auch in Europa eine Vielzahl von Problemen, ge­ rade die hohe Jugendarbeitslosigkeit.
732|52ce8aa32c48b8e5e432ce94be48e07f|Lautstärke verringern
733|766529b387dccf8b7502eb58dd33e8c4|Die Gebirgskette zieht sich quer durchs Land.
734|21d504403a4648261113bd7103c6de52|Weg damit!
735|0b10ae95f6236c27c36eefcf1e3408d3|Es sieht nicht nur nach Bestechung aus, es ist Bestechung.
736|b265ff51ac2e688aee5a3d2b951d5e55|Bitte schön!
737|f8de0126841bb0196a2e2f075c22870e|Ich erwarte von Seiten der Wirtschaft, dass sie nicht einfach sagt: Wir brauchen jetzt nur ausländische Fachkräfte.
738|68cd42f1be7953fad1c27c73f97dbbd6|Zähle von acht rückwärts
739|2147857006d825d1e0ca51acb9c0fd5a|Sie drängelte sich einfach vor.
740|656428317e14c017538f666255f9dab7|Die NATO überlegt jetzt, ob sie sich in der Ausbildung im Irak mit engagiert, aber insgesamt halte ich solche regionalen Koalitionsbildungen für die bessere Antwort.
741|c1e058979d67475b362a491a3b9ec20d|Dieses ist ein nicht immer unumstrittenes Projekt, aber von außerordentlicher Wichtigkeit, wenn es darum geht, Menschen mit unserer Natur vertraut zu machen.
742|7d981ed0d49dbf1d79f9412776ade468|Dann nahm Herr Birnbaum das Zepter in die Hand.
743|553eac1f2f5ae42b451e7590c10b527f|Frühlingsgrün,
744|7066c17afdc0c979823b452cbbe54fff|Auf das Wetter natürlich auch.
745|bd694901ce38ed4ae867fb84cf283946|Halten Akkus im Kühlschrank länger?
746|83e71d83b2dcea23dcab3b64182494cc|neu
747|65d5d08e8043993a5d0f2a231ab60aaa|Den Spruch mit Mann, Frau, Fahrrad und Fisch checke ich nicht.
748|ad867e487ecbc18b270faab58931a8e1|In der Zeit kann ich mich dann schön betrinken.
749|776606b1e3657726a381a10962db20a2|Niesel
750|5679d735385fb21c731527c8abc1df5b|Auf einer Anhöhe nahe der Ruinen sammelte sich das Volk.
751|407088d8360b7fde070839afc9c151ac|Ich mag deinen Mantel.
752|4fdcb44e85734c0a0a1cf4a6ccaa70ff|Viele Staaten unterhalten aber inoffizielle Vertretungen in Taiwan.
753|e39871ad54fae61d433209a0e235a5d3|Ein bisschen.
754|4b6e92fda2be63580f73994f0db062da|Ich würde gerne den alten Trampelpfad kaufen.
755|56f003426e879b1dfdfebf16b8074929|marone,
756|8ca9029371d728ed285374e34d4b9a20|Ja ja, ich weiß. Ich sollte sie mal gießen.
757|67d696195a3012ef76caf6c8c3e0418a|Füll einfach den Bestellschein aus und schick ihn ab.
758|6694aaf72db2237eaad8e045e8354995|Die Einstellung der Leute muss sich ändern.
759|940825c3675cea08a8592bc84b04cbfd|Darum ging er zu Fuß dorthin.
760|72e3ef805e8b39b0fa1972091fbcfd86|Wegen der Sicherheit.
761|836a35db78c254f6200d4210f5f4113c|Gerhard ist bei Oskar.
762|708b02f58ba9f6076f23c5271d74eede|Beim Transport werden die Steine stundenlang durchgeschüttelt.
763|a918369c8201e470171e0e0fbdbc8596|Damit Behinderte in unserer Gesellschaft ihren Platz haben – einen gleichberechtigten Platz neben allen anderen Bürgerinnen und Bürger in unserer Gesellschaft.
764|769e2adae624ca24619b9ceb649f5d98|Der Abbrecher richtete den Blick deprimiert nach unten.
765|86bcf623ebe2b88f8cdea8bbea5be4a4|He, Sie haben mir nicht geantwortet!
766|d2206f10db9bdaebc55064dc09a8b3ce|An Christi Himmelfahrt ist Vatertag.
767|f8bde6ae417daedf9ceb448e0ae98f92|Dazu benötigen Sie kein Kochdiplom, das geht fast immer gut.
768|dc4da41dad080d29fa13648b949fa5d8|Mit olfaktorischer Wahrnehmung ist der Geruchssinn gemeint.
769|56db930eb6d988a9aa8cac3c097d9b24|Niemand will es gewesen sein.
770|65391ab7349e1e8dcd9e35d1f06c3e33|Das Zeug aus der Pfeife musste sie doch richtig umgehauen haben.
771|b7edf64144c2f67ee04b5ec12b0443bf|Ein bisschen, sie ist ein bisschen größer als ich.
772|9360ae7208eb35f5797f06b458173e1a|Vom äußeren Erscheinungsbild her sagt mir das Kloster sehr zu.
773|ba72c400a3278a7d978ee456cd3d390e|Daneben lebten auch pantheistische Weltanschauungen in kleineren Glaubensgemeinschaften und unter Einzelpersonen fort.
774|331246b70ac0e86979079ad26f4b5938|Doch dann wurden sie vertrieben.
775|8c81fe51fec84a40161ba90fddd15651|Rayen hat Paul voll auf die Nase geboxt.
776|32d1ef1027bf82e9f4133bf661638c69|Sie stand auf der Empore und mampfte ein Brötchen.
777|0bb8aae6c5509ea3f38dc199b12f95a4|Weshalb sonst würde er ihr den Hof machen?
778|90c8a095acc3c3a8074ae99c7a4ba08b|Wer soll sich das leisten können?
779|a5efab5366d7deb63c30c2ee321c2d1e|Auch die Motive sind immer dieselben.
780|adf1c79cbc9b39767a1c96c440422308|Die Zeiger gehen richtig, aber das Ziffernblatt ist verrutscht.
781|01c0903fd85db071ce9a8ec0aa58486a|Denn wir sehen: In den neuen Bundesländern gibt es noch nicht so viele Forschungseinrichtungen in den Unternehmen, weil der Firmensitz oft in den alten Bundesländern ist.
782|640f99f27784b4cf975b869468fd5172|Die ein- bis dreifach dreiteilig gefiederten Blattspreiten bestehen aus gelappten bis geteilten Fiederblättchen.
783|b42b0e8c6f1a5dedc9361efacc8fd5f5|Wie oft darf man die Identifikationsnummer falsch eingeben?
784|47285b05a2945b68c94537aa3cfadd00|Es hatte mit dem Grubenunglück in Vorarlberg zu tun.
785|825394ccd85a830aa64f48a2cd57cda1|Voraussichtliches Haltbarkeitsdatum einhalten.
786|ac0a61e310cdddc39b3d91c63e339fe7|Du bist nichts, dein Verstand ist alles!
787|6a1b51f0aa54f4b966c0ab229a14aa59|freigegebener Test
788|a5f52d09ef20af04ddd15d0cf63c282c|Die Charaktere sind abwechslungsreich und glaubhaft. Es tut fast weh, ihnen zuzusehen.
789|6f108cc38551b4a1709f35a1167e5d45|Die Krönung ist dieser Dolch mit ausfahrbarer Klinge.
790|98e2f86493d836a96b73cd706e06f8ab|Die haben uns abgezockt!
791|99277cb2e56c949d0764e28748fcc82e|Alles müsste komplett überarbeitet werden.
792|4dd47f52f05e02236be9c83e3fe65d18|Hat dich jemand nach der Sichel gefragt?
793|e9122cfd3849255209f0276abb1f6330|Bei einer Gegenüberstellung konnte das Opfer niemanden identifizieren.
794|2ff42e4545cc6af9fd6a6341d6d8635a|Schick deine Personenschützer mal zum Herrenausstatter.
795|1ac082ddbbf6f8089a11102a25d31bcb|Welche Skills kann ich installieren?
796|394a844cc3d6d99eb45b4e71afde2c99|Station
797|d27a2cdcc7000020dc0104a0f05cd74c|So Jungs, gleich geht's weiter!
798|f3e9b5cbb5bfb05906a402de29d7ee6f|Samstag
799|ef7e9a64f2ae79c989ad125163c110fc|aliceblau
800|0db2cc1f693f6a59a163b6e64767da72|Ich habe, fünfundfünfzig gewählt
801|4a96eb1cf7a78a0409bd1379277706f9|Texte in vereinfachter Sprache klingen oft seltsam bis inhaltslos.
802|3dd72ecc4bf28afc3a703435e00d95ba|Mir fällt nichts besseres ein.
803|9f60af8442e47f2d5547c571d03cd241|Klebt der Teig oder ist er schön luftig und dehnbar?
804|47c8731a2a00808722ddb120b35d5a79|Durch jede Zwischenstation verzögert sich die Reaktion weiter.
805|b737b523ab605cf11f32dedb55c285d1|Bin ich ein Mensch?
806|17fcff19b3c15b18a5a32f266bdf727d|Was für ein Beat ist das denn?
807|f984cf7a32c5db52d6ed1cb7ac1c7055|Wenn man die Steine richtig wirft, prallen sie mehrmals an der Wasseroberfläche ab.
808|b409ba6ef4ccba2343d64ca9dd36c158|Aktualisiere Openhab Elemente
809|917b0599bfda65d1c5777ba0194907a9|Nach dem Login kommt immer eine Fehlermeldung.
810|2601777e184e73241e90525e77e752ad|Nicht wenn man der Polizeistatistik Glauben schenkt.
811|d27538d34a41eaa0597e753638b5d296|Zu allem Überfluss beginnt er dann auch noch, die Taten zu bagatellisieren.
812|c7c110c6a5bcbc6145494cecbf9bd0ba|Das wichtigste Mittel im Umgang mit Menschen ist Desinfektionsmittel.
813|79055cb5560ee6072beb758b2d001ceb|Auch wenn es ruppig aussieht, herrscht eigentlich ein liebevoller Umgang miteinander.
814|f1d36b152053ce362aa3e5ab1a16fffd|wechsle Aktivität
815|d7900251dd12fe11066ac47598927faf|Qualität hat ihren Preis.
816|3340ea6dadabb67ab38577d9e227e789|Alle Sprachkurse sind ausgebucht.
817|591b001344946a1db75ac89d1343ba2f|Eine gewisse Sozialhygiene schadet niemandem.
818|5bb3176354876f7a16b4f1386b49ba7c|Schluss mit lustig!
819|445e33564c4ce5aee826df492ac1cffb|Einzig und allein Taten zählen.
820|94285d066b68d032d2b82d6cf839cf2b|Du liest vor, als ob jeder Satz eine Frage wäre.
821|7fa059fdc2cc2df858232c6031266708|Und darum folgt die Quittung nun auf dem Fuße.
822|7ad811da68872b9a4208c0a0f14090b8|Ironischerweise wäre der resultierende Konflikt für viele tödlich.
823|5fd7f7e53f5e3d0696f0aede5b48fd46|Vielleicht ist Nikolas nicht der Heilsbringer, für den Sarah ihn gehalten hat.
824|05fdbcecaa85425f30cc21a46d84dee0|Macht euch auf etwas gefasst!
825|918466568ceb752359edbbab24ce2afb|Mehrere Möglichkeiten, drei an der Zahl, stehen zur Auswahl.
826|6fdd7a81eb8a883613ebe6bd1731adea|Zunächst wurden die Neulinge eher skeptisch betrachtet.
827|bfd0754f9d9bcc0d56bfa060f161c92b|Ich verstehe das nicht.
828|a00f89c80dbdf42d425482846619f2f3|Totgesagte leben länger.
829|c5d28557ac6505ea5298f6921c794c99|Beziehen sie Leistungen von Staat?
830|c3e7f331db06beedbe51cf0a8f8aa631|Um Ihre Geldkarte sperren zu lassen, wählen Sie zweimal die Hundertsechzehn.
831|f76096bb282743db4721c70556a1d29c|Überall auf dem Rücken hat sie Brandblasen.
832|24ffff1dea9fa46442a839f7dfbbef9d|Das Epizentrum befindet sich an der Westküste Indonesiens.
833|73452b0eeb96f812c9e6cae4daa73abf|Man kann jeden Euro nur einmal ausgeben.
834|011b1aa389a6db491cc091f17620f640|Bitte wählen Sie nur eine Farbe aus.
835|caff497acce573ce3b4c085dae934a90|Kann man da einfach so rein?
836|75616a74c92fc45b4ce7d092d520a8f0|Alles, was nicht niet- und nagelfest ist, wird mitgenommen.
837|b8b8c7f647d1620bac1002201f8bc736|Jannis hat sich nun ein frisurschonendes Headset zugelegt.
838|c1fdb3916ffb0f81d3624aeb85e69020|Materieller Reichtum hängt kaum mit empfundenem Glück zusammen.
839|2ff2804d074311a9f0536f00c701857a|Man nehme Salz und Pfeffer und würze gut nach.
840|e9b91e1b0f0a83335bdc26f051c4fd80|So wäre das in einem gesunden Wirtschaftssystem.
841|5642b1fecc23ea1617b4ca10a4aa029b|Sind die echt?
842|da70a471c14ed1425020f1d2d736fc4f|Deine Ausreden will ich gar nicht hören.
843|e07cfac16f0d1bfead1ded99cd98e269|Wir wünschen uns doch alle ein friedvolles Miteinander.
844|287d92c6b1231765b979c964cc74e5cd|Die Ladezeiten werden mit Videos überbrückt.
845|0824c2f7e69b354fc8368197fec85afc|Ich hab ein Veilchen gesehen, das in der Ritze einer Ziegelmauer wuchs und blühte.
846|a11338e9503e124c07ef6166fd317c33|Viele der Demonstranten machten deutlich, dass sie strikt gegen Gewalt sind.
847|b5457eabb114d0aa7d1e94eaa2871382|Ohne Martinshorn käme der Krankenwagen schneller durch.
848|b77e639a8de3d93865333a09b2fd5447|Was sagt uns das?
849|f1eac4032790865f57e98fa5894983f1|Dann müsst ihr euch einen anderen suchen.
850|44f1e501e94b0cec356c6665fd9ab938|Minecraft Chat
851|ade957e7dbe1b0a497451273998ff513|Von nun an steckt Frau Leifert in einem Zwiespalt.
852|e674bd1a48a493d23931dc9ed6a3f02a|Dort, wo das Wasser flacher wird, brechen sich die Wellen.
853|529c97d332644d2bcf8a2714c0d9b23d|Er habe zwar nun dies Geschehen nicht selbst vor Ort mitangesehen.
854|c0c13c837a93ac0ef623c6a16bd36a48|Da ist doch überhaupt nichts dabei!
