855|7e442b6430f187f229c7990a3297a45c|Deswegen hat die Wohnungsgesellschaft nun Rattenköder ausgelegt.
856|9cef82385f9e387ba3f99798b7b85b45|Geh schlafen
857|be27ecef0ad1e7b5b415e6e288463377|Dazu gehört für mich vor allem das Gesetz zur Förderung der Gebäudesanierung, das heißt: zur energetischen Sanierung von Häusern.
858|3e6fc66de74005adf3efb73483d695d2|Stichwort interaktives Fernsehen.
859|201cbbd1f17c8b60630a7fff5720a45e|Fett ist zäher als Öl.
860|d3964e4ce0f000875f5ad98fb640a7a3|Vor uns fuhr ein Streifenwagen, der uns mittels Kelle dazu aufforderte, anzuhalten.
861|2f44055f18fb8a5b1fc6edd1969104c9|Dann lasst uns doch eine Sammelbestellung für die ganze Klasse machen!
862|ec28a676b2d84be3fa537d0a15526eb8|In der Wissenschaft ist man bei P H wie in Photon und Photosynthese geblieben.
863|af4eaf69ad3ab393584c1d99fd13fe78|Er erpresst Schutzgeld von zig Leuten und hat dabei nicht mal ein schlechtes Gewissen.
864|e81a118f21bc668abb144b2a017903e8|So ein verlogener Verein!
865|5390767dc0ea664c028627ef61579dcb|Wenn du sie hackst, kämpfen sie für deine Seite.
866|9f6514ce50c36e4eb1205d537019529e|Vorsicht, der Bon kann ausbleichen!
867|e9a57a18b0a64869820ef0b30f1cb9cb|Eierkartons gehören ins Altpapier.
868|71347680bca88b6004e0ed8fdf139f0a|Soeben ist der Herr Direktor mit seiner Gemahlin eingetroffen.
869|a25b2dff7d13c650e6c7e6bfb3bba5a3|Houston
870|a6fbc978b117908d3d5670e3c95d50d3|Ist das sonst noch jemandem aufgefallen?
871|d3fceebaadb9bd3d395c0d8d73b418ed|Ich nehme ein Bier und das Tagesgericht.
872|ff15bb7e7cd3f5aaf85d65496c9916fa|In Sekundenschnelle legte Neumann seine Ausrüstung an.
873|779ee9e5d2604bf828b29d5a81f4ab71|Es muß noch viel mehr gearbeitet werden.
874|3de0722b9dc56f40e8e3b3fa63b89cdc|Es entsteht eine unangenehme Stille.
875|e37e3a887041e2583c806b1b9e80ca6f|Mir reicht's. Ich reiche die Scheidung ein!
876|ad42f36abded1e7f7a8f7287fbde19f7|Quält Sie auch die Sehnsucht?
877|6fc501b9b65d7f40fd222916d0e257cf|Ronja wird ihn wohl kaum verschonen.
878|ce1a182c81c361e55ab72efcf3d3403b|Ein Schiff aus Afrika bringt hunderte Tonnen neues Streusalz.
879|07daa8f93e3a2fa44c5f99e86c14fdb8|Wann sind Nudeln al dente?
880|068f70dd9b4d0ce2eca11d2c80c30a9a|Der Erzähler machte eine Kunstpause.
881|44d05b66b2dc761c9c7bc5f881d55c0a|Die Folgen sind verheerend.
882|70146c8487568c1989d1e35ad62853f4|Das Vier-Augen-Prinzip soll Missbrauch verhindern.
883|3cfa8ea037d0757b6d9469a03944bccc|Nimm doch mal das Handtuch aus dem Mund.
884|115d64601b4664579ada205b8ebca604|Doch wie kam es zu dem Fiasko?
885|f5edb5367e9217e476052fac0f95b6b6|Sie demotivieren meine Mitarbeiter!
886|4f632fae2acffd7684609e7d3d820eb7|Die beiden werden bestimmt schwer.
887|707dd8f1ef8933aebb52e11bc9ff68d1|Es gehört als festes Ritual einfach dazu.
888|72c3b6f52c14d04fb73dd24514e7594a|Deshalb erkennt man sie an aufwendigen Kühlkörpern.
889|650f91a6801a54d94c8a47996f6d74b8|Maybrit Schirmer kam mit einem verpixelten Gesicht auf die Welt.
890|a611b99d5163cfcf8f91c76e892c0c6c|Hier hat sich ein Fehler eingeschlichen.
891|c497e5f39e6fdb0659d0a900d916c077|Auf dieser Strecke gibt es immer Stau.
892|49c38cbc9f4aedc984e30cf10099d738|Mit Geringschätzung blickte der Adel auf das Proletariat herab.
893|bb6c7f0eac4bb09beaa5a7d710f932a0|stoppe Monitor
894|764ee247202f7233fddbb0d8b46ce952|Setze Märchen fort
895|01f384391e18f71e6dd9ae4c07d5f87f|Hast du neben der Duschkabine geduscht oder warum ist der Boden so nass?
896|0ce1e9fbc5773c5f97bd490c0bc076b4|Eine leistungsfähige Antenne fürs Fernsehen lässt sich relativ einfach selbst bauen.
897|84bd2bc1ce9d10d2e14cae1af19a80a0|Was er wohl denkt, was hier drinnen abgeht?
898|5961dd91556129e677685c881a120874|Siehst du die Zielscheibe dort?
899|a85724153de3338e4b3ea015f3841e39|Wann das passieren wird, steht leider in den Sternen.
900|d0d441fea97e0606ce9827bf525907dc|Aus der Kontrollgruppe klagte niemand über Sodbrennen.
901|529087dd8eede61d75f55380e5f3fc0b|Ich würde gerne mal mit Gott über die Welt sprechen.
902|3ebb945501cf5d1a673edc36f9bad19a|Zwei Komma fünf vier Zentimeter entsprechen einem Inch.
903|2d7a598cf94c3a49b196e9f3881e0dd0|Alte Leute gleichen ihr Verhalten wieder an das von Kindern an.
904|4545387b9ad12e4640fb563c4712e88c|Doch gegen dieses Ungeheuer war er machtlos.
905|698290607f662b1ff04ea754b76cde63|Es war das beherrschende Thema in den Lokalnachrichten.
906|470bdb586434d2139a2dd46e10a45585|suche Datei
907|d1c468da3dd18773071789ae02f8b6ba|Damit schießt sie sich selbst ins Knie.
908|f06a5204be2dd240685d4f01f6606043|Christie Brinkley arbeitete dort an ihrem Modelbuch.
909|256bed22b0b11a7443ff9034e5a2702b|Heutzutage kommen auch noch Tippfehler dazu.
910|f918d834aeb1822fa257169d3c29ad46|Dann würde man die Kugeln wieder leer pumpen.
911|87a7d791735ec40195695927ede4eff0|Jetzt müsste Ihnen eigentlich der Mund offen stehen bleiben.
912|466e3e65ed8dd61cc9873a7eec12c75a|Fahren Sie den Wagen mal auf die Hebebühne!
913|e19f607985a53b929d45fc81c149b7e3|Im deutschen Sprachraum hat sich bisher keine genauere Definition des Forschungsgegenstandes durchgesetzt.
914|0d545e57ac9ffd3c29ec27d5ae8d21ce|Die Arme!
915|809442a52267b6aeb6af3e6511ad832c|Genau wie die Äffchen in Thailand.
916|49ecd67c9af22315312c2976ce857bb8|Mango, Ananas oder Papaya wachsen nicht in Deutschland.
917|93a76bb246ce3aa89d1f3991b0ef4f64|Damit will man den Kreislauf solange in Gang halten, bis der Notdienst eintrifft.
918|6de88bcd434bf262f60182b9103d34cb|Halleluja!
919|d7b2ea6d35be1da666e90bed4cd257dd|Dazu ist es jedoch völlig ungeeignet.
920|7922f53440687065429976c6159953aa|Welches dieser drei Szenarien beschreibt Ihre Situation am besten?
921|5e24457d3da0afe403feb651eb4e388f|Die Portierung auf die Playstation entpuppte sich als echter Renner.
922|67b482be851110873dfda63b1f61b684|Sternschritte zählen natürlich nicht als Schritte.
923|78f0ca97e23caedcea0ad19de16e28fe|Kannst du die Farbcodes der Widerstände entschlüsseln?
924|6fca7c72403e7307c6cf74b910c5a453|Bist du bereit für die nächste Runde?
925|8a9e622521fdd72812961b81d0172627|Ich fürchte sie ist weggelaufen. Schon wieder?
926|ab94e40c4c32966874960847c8dd6d01|Noch mal kurz etwas zu den Begrifflichkeiten.
927|a5f7736210f7a261996ab4dccbb7036a|Redet mir doch nicht immer dazwischen!
928|75262bd19b6c1ae6c5bfdf5becf8a4c1|Kommt, wir schießen auf ein Pulverfass!
929|037d09c7b7a5072ad3a99656edc10236|dunkles grau
930|e0c410971501fb5d9cb81759400e7757|Der furchtlose Junge wollte mit seinem Vater auf die Drehleiter.
931|8f659f1e8cb17d73661267f3f9e05f15|Eileen Fricke meint, die Züchtung wird ein Selbstläufer.
932|00a823dbdce8df6f8c2281a381c735f7|Bei der Füllung und den Beilagen kann man variieren.
933|1183a82b536df61a8d6e18c491f6e13f|Einen Finger hat er auf der Umschalttaste und einen anderen suchend über der Tastatur.
934|a45f79c0c052bd8b667ab8f281f4fbd9|Schnellzüge sollten mit moderner Technik statt mit Kunst ausgestattet werden.
935|0c4b8ce238274336f3b4666e2a9eacd1|Die Fähre startet von Dagebüll und fährt über Föhr nach Amrum.
936|a7878e8e196c6f1b011d4187f3763cd3|Herr Brehme, das Anliegen ist von höchster Priorität.
937|11c150452d301e623aa89f1dfc8c0703|aktualisiere Open Hab Elemente
938|bce736af4bf56610f379a9f60ea4e6b7|Das Teil ist ja auch komplett durchgebogen.
939|29acbfd561091358647fc73664f0b6e2|Aber die eigentliche Party steigt woanders.
940|af50046a11977cbc57abd389895d283f|Ein Mann in Latzhose trägt weitere Ausrüstung zum Mannschaftswagen.
941|0bce96d910198aa61012ba88bba3f3f0|Dombauer sitzt schon länger im Kongress und gilt als Hardliner.
942|954d3da891d5ecaed7e7e0082eec9c8b|Es gibt immer einen Ausweg.
943|8f33b2531e716cdfd01224a09f0b9f07|Wie laufen die Verhandlungen?
944|34a07ad2805f61ba0d0d9973020683a2|Auch die Verarbeitung hinterlässt einen guten Eindruck.
945|c106841a749041ac287d121fe46f7c0c|Ich bin nicht bereit, mich unterzuordnen.
946|985893dc64e99f722a0469dcef8430fe|Sprich mir nach!
947|5cf0466c08f2fd95b9a72cf7817665a1|Des einen Freud ist des anderen Leid.
948|6a2be40703e80e90bc070f5d355317c0|Dürfen wir hier einen Film drehen?
949|e46cb93c9d281e836d8e2cb18d713d18|Kaum jemand lernt schwimmen, wenn man ihn ins kalte Wasser stößt.
950|d7f9ffb3da45204a44fa7d26e498c85e|Natürlich hat Merlin seine Karte sofort sperren lassen.
951|39af36309d260c9a42cd1f5e974e206c|Am Schweizer Forschungsinstitut wurde das World Wide Web erfunden, nicht jedoch das Internet.
952|6bba4a9fa7c87ff7e35ab5bd4a50e0ba|Nicht die Flammen, sondern die Glut sind das Heißeste am Feuer.
953|36306c19bdd6141f08afc2e2339d023a|Bei der Bundeszentrale für politische Bildung kann sich jeder das Grundgesetz kostenlos bestellen.
954|4d97fbacd635adaaec686aa3f4d24196|Seitdem war die Brieftaube spurlos verschwunden.
955|4f2b4cc2230326f5713971cd1b0be856|Aber ich freue mich trotzdem, ein paar Tage auch fern von Berlin zu haben, mich etwas mehr zu bewegen, als das im Büro der Fall ist, und dann auch an der frischen Luft zu sein.
956|34a4f7e2369116eb21fc60b6949b9075|Man kann nicht zweimal für dasselbe Verbrechen verurteilt werden.
957|bd5069a7a7492b879e1d40c4f3474bd2|Einfach immer der Hauptstraße folgen.
958|ca0f7e2caeb08ab4dec9d32788654e2f|Der ist sauber.
959|a2901a5f31d9c09a25d3fdb59d70adea|Ein Schauder lief ihr kalt den Rücken runter.
960|5ab2f53498494c9030c20bb63c065c0e|Aber das war es dann auch schon wieder.
961|d4e1ede91eff3e1212222a5a1be253d3|Man darf die Hoffnung nicht aufgeben.
962|6fc87b5b93db1e0b634492e3ac8ae468|Weiß Rafael von dem Geheimnis?
963|e52e42b85f9aced6bcca72c484b196f3|Das ist mir immer noch lieber, als wenn Petersen sich daran versucht.
964|4356f3629a72431ad699f43e2d1b7597|Wenn du mit meiner Generation sprichst, sprich laut, deutlich und wiederhole alles.
965|220ca1f74edc979474b6d86068f656d3|Die Oberklasse ist von Spurhalteassistent bis Einparkautomatik mit allem Pipapo ausgestattet.
966|f76974abe10e0f22eb4a2d104361c3df|Um Gottes Willen!
967|81cb9237e36b7968426e462ea4da192a|Bei der Tipperei fängt doch gleich wieder meine Schulter an weh zu tun.
968|db28ba9b117f25b3cdea9dfdef1eb02d|Gina hat nun endlich ihr Latinum.
969|9021e52bfd11b42c9f1d06a11532ea7a|Hier kann man nicht mal Parkour laufen, ohne dass jemand die Polizei ruft.
970|d16b693893bdf19fb751fa522d918d7b|Was tut man, wenn jemand tödlich verunglückt?
971|47f33520ebf7a73ea6844367d67a3373|Es wurde verdammt noch mal Zeit, dass jemand diesen Missstand aufdeckt.
972|0b06250f846cc8da0ab69f879b5b6797|Mitglieder sind neben Datenschutzbehörden auch Regierungsstellen, Vertreter internationaler Organisationen sowie Wissenschaftler aus aller Welt.
973|913d4cbf22cb810b7dc09a774bf24bcb|Hilf mir bei
974|8e4ff1d558e0c62c2b799f0096682b82|Dort ohne Sicherung heraufzuklettern, ist schon nicht ohne.
975|337b6881b9c5092913c96ceb74535aa9|rufe Test auf
976|6cd1e736cf15593d39dcdbb232f992e5|Ich bin für das Verursacherprinzip.
977|d1325ef3120b2f455eb55274897fe8e9|Fahr vorsichtig!
978|c79c5da3b7a677bfdeebb4cc42d2094c|Junge und alte Menschen wohnen gemeinsam in einer Wohngemeinschaft.
979|6b397376ccdefa24c9f4ddf3ef82d28d|Das ist Amtsanmaßung!
980|f56681d8b394fb87334ff710adf32d7d|Professor Steiner hat mich voll in die Irre geführt.
981|49385c37243367320579fd048ee59839|Nicht so lasch!
982|6b8b8f8863980796af2849f5be707d6e|Ja, das war von Revell, zum selbst zusammenbauen.
983|82d3ff80853f9e655b2c89a443c844fd|Synapsen verbinden die Neuronen untereinander.
984|438bc3a3541889762c0f43ec63d61b7e|Dem aufmerksamen Leser dürfte das bereits aufgefallen sein.
985|d7f538812666b18d5775c90e6da1c7d7|Ich möchte nicht, dass das Display immer mitrotiert.
986|7e00182b2037e571a9aaf20a51ad5d88|Sicherlich war der Sprengmeister jederzeit Herr der Lage.
987|195ceb121cc386595d883491b0679a3a|Anette ist mit Bernd verheiratet.
988|7f1e1d83280a296bc278865676e76665|Probier mal von dem Sanddornlikör!
989|eabf18fb064d51474d4da7e79915d1c4|Das reimt sich ja.
990|3af2d0a71be14807283480ec26433c49|wovon Schätzungen zufolge fünfzehn Prozent Kurden waren.
991|33e649d1f438ac14a0f176a15735dff9|Ich lehne ihn sogar ab.
992|6ac2af6d1e1c841b1b49db4c36dec694|Die Anrainerinnen ärgern sich über die Schotterfuhren.
993|5c91c1a492b8662906febd3c99caa6e1|In schwarzem Tee ist die Konzentration vergleichsweise hoch.
994|2fa89b06cf4196b88fa29a8a0fdc62ee|Meldet euch freiwillig!
995|bf9febf36f969c8889e099d4a7e49320|Die Vorstellung, dass nach einer Knochenmarkspende jemand genetisch identischen Blut hat, lässt sie erschaudern.
996|bea983b37e65f3f93349441cc48ea926|Frankfurt am Main sollte man offiziell in Bankfurt umbenennen.
997|5d5a8f0a60a0c21353128526cddf8380|Was schreibst du auf dein Banner?
998|2aeb5da2dd2d5749916b0b1e37414c09|Annika hat einen Karpfen am Haken.
999|df45fd33df9f0f19278ed844bc0cdde8|Mithilfe von maschinellem Lernen werden wir eines Tages die Sprachen der Tiere übersetzen können.
